OKRs,No,Score,Status,Tasks
,1,50,Done,Moderate DAO-Daily Standup and main governance meetings
,5,50,Done,"Engagements and meetings: organize, moderate, and provide meeting notes if necessary. Follow up on action items."
,6,50,Done,Recruit candidates based on Lead requests
,4,50,Done,Coordinate with Tomato and moderate Discord server
,2,50,Done,Weekly Summary
,3,25,In progress,Come up with an approved bounty process
,7,50,Done,Keep up-to-date and accurate daily record of  $JOY value for term
,8,50,Done,WG Scoring
,,375,Null,Total